<?xml version="1.0" encoding="UTF-8"?>
<!ELEMENT book (lg*)>
<!ELEMENT lg (l*)>
<!ELEMENT l (#PCDATA)>
<!ATTLIST lg
    n CDATA #REQUIRED >
<!ATTLIST l
    rend (indent) #IMPLIED>